Kazakhstan,National,Proposal,"Support the local manufacturing of EVs, including tax incentives and subsidies for EV producers.",2024,Manufacturing,Government of Kazakhstan
Malaysia,National,Legislation,Income tax rebates for EVSE manufacturers.,2024,"Taxation, EVSE",Government of Malaysia
Malaysia,National,Legislation,"Exemptions of road, import and excise taxes for electric vehicles.",2024,"Taxation, Multiple",Government of Malaysia
Mozambique,Multi-national,Objective,"Signatory of the Memorandum of Understanding (MOU) on Zero-Emission Medium- and Heavy-Duty Vehicles, which targets 30% ZEV sales in M/HDVs by 2030, 100% by 2040.",2024,M/HDV,CALSTART: Drive to Zero MOU
New Zealand,National,Announced target,Aiming for a network of 10 000 public charging points by 2030.,2024,EVSE,Government of New Zealand
New Zealand,National,Legislation,"Low Emissions Heavy Vehicle Fund (LEHVF) of USD 27.75 million towards offsetting the purchase price of low- and zero-emissions heavy vehicles. The LEHVF will contribute up to 25% of the cost of new zero- and low-emissions heavy vehicles, and up to 25% of the cost to convert existing higher-emitting heavy vehicles to be powered by low-emissions technology.",2024,M/HDV,Government of New Zealand
Norway,National,Legislation,VAT (25%) exemption for BEVs below NOK 500 000 (€ 44 000) price (Introduced in 2023)​.,2024,Taxation,Government of Norway
Pakistan,National,Announced target,"New Energy Vehicle (NEV) Policy, aimed at transitioning 30% of vehicles stock in Pakistan to electric by 2030.",2024,Multiple,Government of Pakistan
Philippines,National,Legislation,"A tax incentive programme has been expanded to electric 2/3Ws, HEV and PHEV cars until 2028 to improve the affordability of EVs for consumers.",2024,Multiple,"Department of Energy, Philippines"
Indonesia,National,Announced target,Indonesia sets aside USD 455 million to subsidise the sale of 1 million electric motorcycles.,2023,2/3W,Government of Indonesia
Ireland,National,Announced target,"35% ZEV share of HDV registrations by 2030, with an interim target of 700 units by 2025.",2023,M/HDV,Government of Ireland
Ireland,National,Legislation,"30% of stock, and 100% of sales passenger LDV sales to be EVs by 2030 (2023 reiteration of 100% sales target and formalisation of 30% stock target, ca. 950 000).",2023,LDV,Government of Ireland
Israel,Multi-national,Objective,"Signatory of the Memorandum of Understanding (MOU) on Zero-Emission Medium- and Heavy-Duty Vehicles, which targets 30% ZEV sales in M/HDVs by 2030, 100% by 2040.",2023,M/HDV,CALSTART: Drive to Zero MOU
Japan,National,Objective,300 000 charging ports including 30 000 public fast chargers (and 1 000 hydrogen stations) by 2030.,2023,EVSE,Government of Japan
Kazakhstan,National,Proposal,Roadmap for EV Infrastructure: Aim to create the infrastructure necessary for electric cars in all big cities throughout the country by 2029.,2023,EVSE,Government of Kazakhstan
Korea,National,Legislation,"Grants available towards the purchase of private and commercial LDVs, which can be combined with additional local incentives.",2023,LDV,Government of Korea
Korea,National,Legislation,Grants towards the purchase of electric buses.,2023,Bus,Government of Korea
Malaysia,National,Announced target,Foster robust local EV manufacturing capabilities to achieve 90% local EV manufacturing by 2050.,2023,Manufacturing,Government of Malaysia
Malaysia,National,Announced target,80% share of electric vehicles in two-wheeler fleet by 2050.,2023,2/3W,Government of Malaysia
Malaysia,National,Announced target,80% share of electric vehicles in car fleet by 2050.,2023,LDV,Government of Malaysia
Malaysia,National,Legislation,"Tax relief for companies investing in EVSE manufacturing, as well as import duty and sales tax exemptions for locally assembled EVs to the end of 2027, and imported EVs to the end of 2025.",2023,"Manufacturing, Taxation",Government of Malaysia
Malta,National,Legislation,"Grants towards the purchase of private and commercial BEVs, with an additional bonus for scrapping an old vehicle",2023,LDV,Government of Malta
Mexico,National,Proposal,"50% of passenger vehicle sales to be HEVs, PHEVs, and BEVs by 2030, 100% to be PHEVs and BEVs by 2040, and 100% BEVs by 2050",2023,"LDV, Bus",Government of Mexico
Mexico,National,Proposal,"Deployment of 338,000 electric HDVs by 2030, 894,000 by 2040, and 987,000 by 2050.",2023,"M/HDV, Bus",Government of Mexico
Mexico,National,Proposal,"Deployment of 7M electric LDVs by 2030, 22M by 2040, and 31M by 2050.",2023,LDV,Government of Mexico
New Zealand,National,Announced target,Comprehensive EV charging strategy including a target for a charging hub every 150-200km on main highways by 2028.,2023,EVSE,Government of New Zealand
Nigeria,National,Legislation,Vehicle finance scheme aiming to facilitate the adoption of 45 000 passenger cars and 50 000 commercial vehicles per annum.,2023,"LDV, Taxation",Government of Nigeria
Nigeria,National,Legislation,"Nigerian Automotive Industry Development Plan (NADIP) aims to boost local production of vehicles (40% local content target) and promote EVs (30% locally produced vehicles to be electric) by 2032, with incentives including reduced import duties and tax incentives for manufacturers.",2023,Manufacturing,Government of Nigeria
Norway,National,Legislation,Norway will introduce value added tax on higher-cost EV purchases from 2023; previously all EV sales were exempt from value added tax.,2023,"Taxation, LDV",Government of Norway
Papua New Guinea,Multi-national,Objective,"Signatory of the Memorandum of Understanding (MOU) on Zero-Emission Medium- and Heavy-Duty Vehicles, which targets 30% ZEV sales in M/HDVs by 2030, 100% by 2040.",2023,M/HDV,CALSTART: Drive to Zero MOU
Philippines,National,Objective,"Deployment of 600, almost 1 200, and almost 1 800 new BEVs over the period up to 2028, to 2034, and to 2040, respectively, in the Business as Usual case. In the Clean Energy Scenario these figures are over 2 200, almost 1 500, and over 1 600.",2023,Bus,Government of the Philippines
Philippines,National,Objective,"Deployment of almost 110 000, almost 200 000, and almost 300 000 new EVs over the period up to 2028, to 2034, and to 2040, respectively, in the Business as Usual case. In the Clean Energy Scenario these figures are over 550 000, almost 650 000, and over 850 000 and a greater share of early adoption is HEVs, with later adoption predominately BEVs.",2023,LDV,Government of the Philippines
Philippines,National,Objective,"Deployment of over 200 000, almost 400 000, and over 550 000 new EVs over the period up to 2028, to 2034, and to 2040, respectively, in the Business as Usual case. In the Clean Energy Scenario these figures are almost 1.9 million, over 1.2 million, and almost 1.2 million.",2023,2/3W,Government of the Philippines
Indonesia,National,Legislation,Presidential instruction Indonesia requires government offices to procure and use EVs.,2022,Multiple,Government of Indonesia
Indonesia,National,Legislation,Tax incentive scheme to reduce the cost of electric LDVs and buses with shares of domestic components.,2022,"Taxation, LDV",Government of Indonesia
Ireland,National,Announced target,"Various grants and funding schemes in place to support infrastructure development, aiming for at least 11 HDV charging pools to be installed by 2025.",2022,EVSE,Government of Ireland
Ireland,Multi-national,Announced target,"Signatory of the Memorandum of Understanding (MOU) on Zero-Emission Medium- and Heavy-Duty Vehicles, which targets 30% ZEV sales in M/HDVs by 2030, 100% by 2040.",2022,M/HDV,CALSTART: Drive to Zero MOU
Ireland,National,Legislation,Grants towards the purchase of passenger and LCV BEVs.,2022,LDV,Sustainable Energy Authority of Ireland
Ireland,National,Legislation,"Grants for BEV public service vehicles, including bonuses for the scrappage of older more polluting vehicles with high mileage.",2022,LDV,Government of Ireland
Ireland,Multi-national,Objective,Signatory to COP26 ZEV Declaration to work towards all sales of new cars and vans being zero emission by no later than 2035 in leading markets.,2022,LDV,Accelerating to Zero Coalition
Israel,Multi-national,Objective,"The pledge goal is 100% zero-emission LDV acquisitions of civil government owned and operated fleet, with aspirations for 100% zero-emission M/HDV acquisitions, by no later than 2035. Israel also specifically aims for all new government passenger vehicles from 2022 to be hybrid, and all electric from 2025.",2022,"LDV, M/HDV",Zero Emissions Government Fleet Declaration
Israel,Multi-national,Objective,Signatory to COP26 ZEV Declaration to work towards all sales of new cars and vans being zero emission by no later than 2035 in leading markets.,2022,LDV,Accelerating to Zero Coalition
Italy,National,Legislation,"Grants towards the purchase of a new BEV, lower amount for PHEVs, with an additional scrappage bonus available.",2022,LDV,Government of Italy
Italy,National,Legislation,Phase out new ICE cars by 2035 and LCVs by 2040.,2022,LDV,Government of Italy
Italy,National,Legislation,Grants towards the purchase of electric LCVs.,2022,LDV,Government of Italy
Italy,National,Legislation,Grants available towards the purchase of EV trucks.,2022,M/HDV,Government of Italy
Italy,National,Legislation,30% of the purchase price (up to EUR 3 000) for BEV and PHEV two/three-wheelers. Up to 40% (EUR 4 000) if a Euro 0-3 bike is scrapped.,2022,2/3W,Government of Italy
Japan,Subnational,Legislation,Tokyo: Subsidies for selected 2/3Ws to reach goal of 100% of new 2/3Ws being petrol-free by 2035.,2022,2/3W,Tokyo Metropolitan Environmental Public Corporation
Kenya,Multi-national,Objective,Signatory to COP26 ZEV Declaration to work towards all sales of new cars and vans being zero emission globally by 2040.,2022,LDV,Accelerating to Zero Coalition
Korea,National,Legislation,Funding available to incentivise EVSE.,2022,EVSE,Government of Korea
Kyrgyzstan,National,Legislation,VAT exemptions for EVs produced in Kyrgyzstan.,2022,Manufacturing,Government of Kyrgyzstan
Lebanon,National,Legislation,100% exemption on customs duties and internal consumption tax for EVs; 50% reduction in registration fees and mechanical inspection fees for EVs; 80% customs duty exemption for hybrid vehicles; expanded coverage to include e-bicycles and e-scooters.,2022,Multiple,Government of Lebanon
Liechtenstein,Multi-national,Objective,"Signatory of the Memorandum of Understanding (MOU) on Zero-Emission Medium- and Heavy-Duty Vehicles, which targets 30% ZEV sales in M/HDVs by 2030, 100% by 2040.",2022,M/HDV,CALSTART: Drive to Zero MOU
Liechtenstein,Multi-national,Objective,Signatory to COP26 ZEV Declaration to work towards all sales of new cars and vans being zero emission by no later than 2035 in leading markets.,2022,LDV,Accelerating to Zero Coalition
Lithuania,Multi-national,Objective,Signatory to COP26 ZEV Declaration to work towards all sales of new cars and vans being zero emission by no later than 2035 in leading markets.,2022,LDV,Accelerating to Zero Coalition
Lithuania,Multi-national,Objective,"Signatory of the Memorandum of Understanding (MOU) on Zero-Emission Medium- and Heavy-Duty Vehicles, which targets 30% ZEV sales in M/HDVs by 2030, 100% by 2040.",2022,M/HDV,CALSTART: Drive to Zero MOU
Luxembourg,Multi-national,Objective,Signatory to COP26 ZEV Declaration to work towards all sales of new cars and vans being zero emission by no later than 2035 in leading markets.,2022,LDV,Accelerating to Zero Coalition
Malta,Multi-national,Objective,Signatory to COP26 ZEV Declaration to work towards all sales of new cars and vans being zero emission by no later than 2035 in leading markets.,2022,LDV,Accelerating to Zero Coalition
Mexico,National,Legislation,"Recognition of lithium as strategic mineral, nationalisation of its value chain. Creation by decree of ""Lithium for Mexico"" (Litio para Mexico), a decentralised public body.",2022,Manufacturing,Government of Mexico
Mexico,Multi-national,Objective,Signatory to COP26 ZEV Declaration to work towards all sales of new cars and vans being zero emission globally by 2040.,2022,LDV,Accelerating to Zero Coalition
Mexico,National,Objective,50% of vehicles produced to be ZEV by 2030.,2022,Manufacturing,Government of Mexico
Morocco,National,Announced target,"Target of almost 30 000 charging points for LDVs, 2/3Ws, and buses by 2030.",2022,EVSE,Government of Morocco
Morocco,National,Announced target,Target of 2 000 electric buses in 2030.,2022,Bus,Government of Morocco
Morocco,National,Announced target,Target of 250 000 electric 2/3Ws in 2030.,2022,2/3W,Government of Morocco
Morocco,National,Announced target,Target of 258 000 electric cars in 2030.,2022,LDV,Government of Morocco
Morocco,National,Legislation,"Reduced duties, green loans and subsidies, as well as exemptions for EVs from luxury and road taxes.",2022,Taxation,Government of Morocco
Morocco,Multi-national,Objective,Signatory to COP26 ZEV Declaration to work towards all sales of new cars and vans being zero emission globally by 2040.,2022,LDV,Accelerating to Zero Coalition
Netherlands,Multi-national,Objective,Signatory to COP26 ZEV Declaration to work towards all sales of new cars and vans being zero emission by no later than 2035 in leading markets.,2022,LDV,Accelerating to Zero Coalition
Netherlands,Multi-national,Objective,"The pledge goal is 100% zero-emission LDV acquisitions of civil government owned and operated fleet, with aspirations for 100% zero-emission M/HDV acquisitions, by no later than 2035.",2022,"LDV, M/HDV",Zero Emissions Government Fleet Declaration
New Zealand,National,Announced target,Reduce emissions from freight transport by 35% by 2035.,2022,M/HDV,Government of New Zealand
New Zealand,National,Announced target,Increase ZEVs to 30% of the light fleet by 2035.,2022,LDV,Government of New Zealand
New Zealand,National,Legislation,The Clean Vehicle Standard sets ambitious targets (and imposes financial penalties for non-compliance) for vehicle distributors to reduce average emissions to 65 grammes of CO2/km for passenger cars and 131 grammes for LCVs for vehicles entering New Zealand by 2029. Revenues generated are used to provide rebates on BEVs and PHEVs.,2022,LDV,Government of New Zealand
New Zealand,National,Legislation,"The Clean Car Discount scheme applied rebates for ZEV and low-emission vehicles, with reduced rates for used vehicles, and fees for higher emitting vehicles. The scheme ended on 31 December 2023.",2022,LDV,Government of New Zealand
New Zealand,Multi-national,Objective,Signatory to COP26 ZEV Declaration to work towards all sales of new cars and vans being zero emission by no later than 2035 in leading markets.,2022,LDV,Accelerating to Zero Coalition
New Zealand,Multi-national,Objective,"The pledge goal is 100% zero-emission LDV acquisitions of civil government owned and operated fleet, with aspirations for 100% zero-emission M/HDV acquisitions, by no later than 2035.",2022,"LDV, M/HDV",Zero Emissions Government Fleet Declaration
Nicaragua,National,Legislation,"EVs are exempt from import customs duty, selective consumption tax, and value added tax.",2022,"Taxation, Multiple",Government of Nicaragua
Nigeria,Multi-national,Objective,Signatory to COP26 ZEV Declaration to work towards all sales of new cars and vans being zero emission globally by 2040.,2022,LDV,Accelerating to Zero Coalition
Norway,Subnational,Legislation,"Oslo: Oslo aims to be the first transport emissions-free city in Europe through a series of ultra low-emission zones. They will also stop the sale of new fossil fuel cars later in the decade, aiming to have all cars zero-emission by 2030.",2022,Multiple,Oslo City Government
Norway,National,Objective,Goods distribution in the biggest city centres to be virtually zero-emissions by 2030.,2022,Multiple,Government of Norway
Norway,Multi-national,Objective,"The pledge goal is 100% zero-emission LDV acquisitions of civil government owned and operated fleet, with aspirations for 100% zero-emission M/HDV acquisitions, by no later than 2035. Norway specifically aims for all new LDVs to be ZEVs, and that all new city buses are ZEV or biogas by 2025, as well as 75% of new heavy vans and long-distance buses, and 50% of new lorries being ZEV by 2030.",2022,"LDV, M/HDV",Zero Emissions Government Fleet Declaration
Norway,Multi-national,Objective,Signatory to COP26 ZEV Declaration to work towards all sales of new cars and vans being zero emission by no later than 2035 in leading markets.,2022,LDV,Accelerating to Zero Coalition
Panama,National,Announced target,"Transition of selected public entity vehicles and transport solutions to EV: 10% by 2025, 25% by 2027, 40% by 2030.",2022,"Bus, Multiple",Government of Panama
Panama,National,Announced target,"Transition of public transport to EV: 10% by 2025, 20% by 2027, and 33% by 2030.",2022,Bus,Government of Panama
Papua New Guinea,National,Announced target,15% share of EVs in all new vehicle sales by 2030.,2022,Multiple,Government of Papua New Guinea
Papua New Guinea,National,Announced target,"Range of subsidies for a limited number of charger installations, commercial vehicles and cars.",2022,Multiple,Government of Papua New Guinea
Paraguay,Multi-national,Objective,Signatory to COP26 ZEV Declaration to work towards all sales of new cars and vans being zero emission globally by 2040.,2022,LDV,Accelerating to Zero Coalition
Philippines,National,Legislation,"Electric Vehicle Industry Development Act (EVIDA) provides fiscal and non-fiscal incentives to support e-mobility including tax exemptions, and also governs the manufacturing, assembly, importation, construction, installation, maintenance, trade and utilisation, research and development and regulation of EVs.",2022,"Manufacturing, Taxation",Government of the Philippines
Poland,National,Legislation,Additional subsidies specifically for the purchase of EVs and chargers by the country's national parks.,2022,Multiple,Government of Poland
India,Subnational,Objective,West Bengal: 1 million EVs in stock across all segments by 2030.,2021,Multiple,Government of India
Indonesia,National,Objective,2 million passenger EV stock and 13 million electric motorcycle stock by 2030.,2021,"LDV, 2/3W",Government of Indonesia
Indonesia,National,Objective,Number of charging stations to reach 32 000 units and battery swap stations to reach 67 000 units by 2030.,2021,EVSE,Government of Indonesia
Ireland,National,Legislation,"Grants up to 60% of the price difference between the diesel equivalent and the BEV, PHEV, or FCEV model available for the purchase of HDVs.",2021,M/HDV,Government of Ireland
Israel,National,Announced target,National Action Plan on Climate Change: Increase stock share of zero-emission urban buses to 50% by 2036 and 100% by 2050.,2021,Bus,Government of Israel
Israel,National,Announced target,"National Action Plan on Climate Change: Target to reduce average emissions from new LDVs by 95% by 2030 relative to 2020, and by 100% in 2050.",2021,LDV,Government of Israel
Japan,National,Objective,Aiming for an advanced introduction of 5 000 electrified M/HDVs in the 2020s.,2021,M/HDV,Government of Japan
Japan,National,Objective,"100% of car sales to be BEV, PHEV, HEV, or FCEV by 2035, 20-30% of LCV sales by 2030, and electrified vehicles and decarbonised fuel vehicles to account for 100% of sales by 2040 (Green Growth Strategy).",2021,LDV,Government of Japan
Korea,National,Announced target,"Install 500 000 electric chargers by 2025 in homes and workplaces, and 17 000 along highways. Install 450 hydrogen chargers by 2025",2021,EVSE,Government of Korea
Korea,National,Announced target,"50% of new sales to be BEV, HEV, PHEV, FCEVs by 2025, and 83% by 2030. 80% of Government operated vehicles to be eco-friendly in 2021, reaching 100% in 2023.",2021,LDV,Government of Korea
Korea,National,Announced target,"3.62 million passenger BEV and 880 000 passenger FCEV stock by 2030 (and 4 million PHEV+HEV), building upon previous target of 1.13 million passenger BEV stock by 2025 (plus 200 000 passenger FCEV).",2021,LDV,Government of Korea
Korea,National,Announced target,"A 2022 manufacturers sales mandate, as a share of annual sales, of 20% for low emission vehicles, and 12% for ZEVs.",2021,Manufacturing,Government of Korea
Laos,National,Announced target,EVs to make up 30% of vehicle stock by 2030.,2021,Multiple,Government of Laos
Lithuania,National,Legislation,Registration tax and VAT exemption for BEVs,2021,"LDV, Taxation",Government of Lithuania
Lithuania,National,Legislation,"Grants towards the purchase of a new private and company BEV, lower amounts for used BEV, as well as higher rates available for PHEVs, with scrappage bonuses available; Grants are extended to charging investments",2021,LDV,Government of Lithuania
Luxembourg,National,Legislation,Grants towards the purchase of a new private BEV; amount of subsidies vary with battery size,2021,LDV,Government of Luxembourg
Luxembourg,Multi-national,Objective,"Signatory of the Memorandum of Understanding (MOU) on Zero-Emission Medium- and Heavy-Duty Vehicles, which targets 30% ZEV sales in M/HDVs by 2030, 100% by 2040.",2021,M/HDV,CALSTART: Drive to Zero MOU
Malaysia,National,Announced target,"Low Carbon Mobility Blueprint includes measures to increase EV adoption, including targets for government and government-led company fleets, incentives for private and commercial EVs, establishment of an e-bus procurement agency, and various manufacturing incentives.",2021,Multiple,Government of Malaysia
Malaysia,National,Announced target,"Low Carbon Mobility Blueprint includes plans to establish a progressively reducing emissions target for new LDVs, exhaust emissions regulations, and other measures to improve vehicle efficiency.",2021,Multiple,Government of Malaysia
Nepal,National,Objective,"25% share of EVs in private passenger vehicle sales (including two-wheelers) by 2025, and 90% by 2030.",2021,LDV,Government of Nepal
Nepal,National,Objective,"20% 4W (i.e. bus and taxi) public passenger vehicle sales, 60% by 2030.",2021,Bus,Government of Nepal
Netherlands,National,Announced target,Zero-emission transport zones to be introduced in 15 cities by 2025.,2021,Multiple,Government of the Netherlands
Netherlands,National,Objective,100% ZEV share of car sales by 2030.,2021,LDV,Government of the Netherlands
Netherlands,Multi-national,Objective,"Signatory of the Memorandum of Understanding (MOU) on Zero-Emission Medium- and Heavy-Duty Vehicles, which targets 30% ZEV sales in M/HDVs by 2030, 100% by 2040.",2021,M/HDV,CALSTART: Drive to Zero MOU
New Zealand,National,Announced target,100% of sales of urban buses to be ZEVs by 2025 and 100% of stock by 2035.,2021,Bus,Government of New Zealand
New Zealand,Multi-national,Objective,"Signatory of the Memorandum of Understanding (MOU) on Zero-Emission Medium- and Heavy-Duty Vehicles, which targets 30% ZEV sales in M/HDVs by 2030 and 100% by 2040.",2021,M/HDV,CALSTART: Drive to Zero MOU
Norway,National,Announced target,All new medium-duty and 50% of heavy-duty vehicles to be zero-emission by 2030.,2021,M/HDV,Government of Norway
Norway,National,Announced target,All new LDV sales to be zero-emission by 2025.,2021,LDV,Government of Norway
Norway,National,Announced target,"All new city buses to be zero-emission or biogas by 2025, 75% ZEV inter-city buses by 2030.",2021,Bus,Government of Norway
Norway,Multi-national,Objective,"Signatory of the Memorandum of Understanding (MOU) on Zero-Emission Medium- and Heavy-Duty Vehicles, which targets 30% ZEV sales in M/HDVs by 2030, 100% by 2040.",2021,M/HDV,CALSTART: Drive to Zero MOU
Pakistan,National,Objective,"Changes to tax codes to promote local manufacturing and export potential of EVs, EV parts, and charging equipment.",2021,"Manufacturing, Taxation",Government of Pakistan
Israel,National,Legislation,"By 2025, all new municipal buses will be electric, with grants in place to help achieve this.",2020,Bus,Government of Israel
Kenya,National,Objective,5% share of electric/hybrid vehicles in total vehicles imported by 2025.,2020,Multiple,Government of Kenya
Latvia,National,Legislation,"Registration tax exemption for private BEVs, up to one registration per person. Private car annual circulation tax exemption for vehicles with less than 50gCO2/km, lowest rate (EUR 10/month) for company cars.",2020,"LDV, Taxation",Government of Latvia
Malaysia,National,Objective,National Automotive Plan 2020 aiming to increase Malaysia's role in producing electrified vehicles.,2020,Manufacturing,Government of Malaysia
Mexico,Subnational,Objective,"Mexico City: Mobility sector emission reduction plan of Mexico city: 30% emission reduction from mobile sources; time-bound partial traffic restrictions, carpooling schemes, LEZ in central city; 10 000 e-bikes and 16 mass bike parking facilities by 2024; 100% electric moto taxis in 2024, incentive scheme; 10% of private cars are EVs or HEVs in 2024.",2020,Multiple,Government of Mexico City
Nigeria,National,Objective,"100% transition to EV by 2060 with interim targets of 1% EV and 2% HEV by 2030, and 60% EV and 20% HEV by 2050.",2020,LDV,Government of Nigeria
North Macedonia,National,Legislation,"On 1 January 2020, North Macedonia introduced a new tax to promote fuel economy for passenger vehicles.",2020,Taxation,Government of North Macedonia
Pakistan,National,Announced target,"30% share of EVs in truck sales by 2030, and 90% by 2040.",2020,M/HDV,Government of Pakistan
Poland,National,Announced target,"Installation of 49 000 slow and 11 000 fast charging points by 2030, with an ambition for as many as 85 000 and 15 000 respectively.",2020,EVSE,Government of Poland
Poland,National,Announced target,"In cities of more than 100 000 people, ZEVs to make up 100% of new public transport purchases by 2025, and 100% of all public transport vehicles by 2030.",2020,Bus,Government of Poland
