Colombia,National,Legislation,"Announcement of the creation of the Technological Advancement Fund. In its first year of operation, backed by COP 12 billion (Colombian pesos), it will cover the price difference between a petrol vehicle (COP 80 million), and a zero-emission vehicle (~COP 110 million).",2024,LDV,Government of Colombia
Colombia,Multi-national,Objective,"Signatory to COP26 ZEV Declaration, committing to work towards all sales of new cars and vans being zero emission by no later than 2035 in leading markets.",2024,LDV,Accelerating to Zero Coalition
Costa Rica,Multi-national,Objective,Signatory to COP26 ZEV Declaration to work towards all sales of new cars and vans being zero emission globally by 2040.,2024,LDV,Accelerating to Zero Coalition
Czechia,Subnational,Legislation,"Purchase incentives for ZEVs & discounted loans on BEVs, FCEVs, and charging infrastructure",2024,Multiple,Government of the Czech Republic
Ethiopia,National,Objective,A ban on the import of non-EVs,2024,Multiple,Government of Ethiopia
Ethiopia,Multi-national,Objective,"Signatory of the Memorandum of Understanding (MOU) on Zero-Emission Medium- and Heavy-Duty Vehicles, which targets 30% ZEV sales in M/HDVs by 2030, 100% by 2040.",2024,M/HDV,CALSTART: Drive to Zero MOU
Ethiopia,National,Objective,500 000 EVs in the coming 10 years,2024,Multiple,Minister of Transport and Logistics
European Union,Supranational,Proposal,"CO2 emission standards: Fleet average reductions of 45% by 2030, 65% by 2035 and 90% by 2040. All new city buses to be ZEV by 2035.",2024,"M/HDV, Bus",European Commission
China,National,Objective,"NEV sales to account for 45% of new vehicle sales by 2025, and 60% by 2030.",2023,Multiple,"China Society of Automotive Engineers, China Automotive Technology and Research Centre"
China,National,Objective,"Establish a high-quality charging infrastructure system by 2030, ensuring city-level full coverage, highway-level linear coverage, and spotted-coverage of rural areas.",2023,EVSE,China State Council
Colombia,Multi-national,Objective,"Signatory of the Memorandum of Understanding (MOU) on Zero-Emission Medium- and Heavy-Duty Vehicles, which targets 30% ZEV sales in M/HDVs by 2030, 100% by 2040.",2023,M/HDV,CALSTART: Drive to Zero MOU
Croatia,National,Proposal,Grants available for alternatively fuelled trucks.,2023,M/HDV,Government of Croatia
Cyprus,National,Legislation,"Grants towards the purchase of new or used EVs, can be combined with a scrappage scheme, higher rates apply to taxis, disabled persons, ZEVs, and large family cars.",2023,LDV,Government of Cyprus
Cyprus,National,Legislation,EUR 400 - 4 000 towards a new electric two/three-wheeler.,2023,2/3W,Government of Cyprus
Cyprus,National,Legislation,Grants towards the purchase of a new ZEV M2 class bus.,2023,Bus,Government of Cyprus
Denmark,National,Legislation,Tax reimbursement for BEV and a reduced rate for PHEVs when purchased as company cars from 2023-2026 and tax-free charging at work.,2023,"LDV, Taxation",Government of Denmark
Denmark,National,Legislation,"Reduced registration taxes for zero- and low-emission cars, increasing gradually from 2026 to 2035. Typically, 60% discount for BEVs, and 35-50% discount for PHEVs. Aiming to reach the same registration tax as is seen on ICE.",2023,"LDV, Taxation",Government of Denmark
Denmark,National,Legislation,Additional financing available for charging stations for housing associations.,2023,EVSE,Government of Denmark
European Union,Supranational,Proposal,"The EU Net Zero Industry Act aims to scale up manufacturing of clean technologies in the European Union, including batteries.",2023,Manufacturing,European Commission
European Union,Supranational,Legislation,"The EU Battery Regulation aims to create a circular economy for the batteries sector by targeting all stages of the life cycle of batteries, from design to waste treatment.",2023,Manufacturing,European Commission
European Union,Supranational,Legislation,"Alternative Fuels Infrastructure Regulation: with respect to electric vehicle charging infrastructure, the regulation sets targets to ensure minimum coverage of publicly accessible recharging points for both light- and heavy-duty vehicles. Coverage is ensured on the basis of maximum distance between recharging pools, minimum power output per charging pool and individual charger power output.",2023,"EVSE, Multiple",European Parliament
Chinese Taipei,,Objective,"EVs to make up 30% of private passenger car sales by 2030, 60% by 2035, and 100% by 2040.",2022,LDV,Government of Chinese Taipei
Chinese Taipei,,Objective,35% of the urban bus fleet to be electric by 2025; 100% by 2030.,2022,Bus,Government of Chinese Taipei
Chinese Taipei,,Objective,All new passenger cars and 2/3W to be zero-emission by 2040,2022,"LDV, 2/3W","National Development Council, Chinese Taipei"
Chinese Taipei,,Objective,"EVs to make up 35% of scooter sales by 2030, 70% by 2035, and 100% by 2040.",2022,2/3W,Government of Chinese Taipei
Croatia,Multi-national,Objective,"Signatory of the Memorandum of Understanding (MOU) on Zero-Emission Medium- and Heavy-Duty Vehicles, which targets 30% ZEV sales in M/HDVs by 2030, 100% by 2040.",2022,M/HDV,CALSTART: Drive to Zero MOU
Croatia,Multi-national,Objective,Signatory to COP26 ZEV Declaration to work towards all sales of new cars and vans being zero emission by no later than 2035 in leading markets.,2022,LDV,Accelerating to Zero Coalition
Curaçao,Multi-national,Objective,"Signatory of the Memorandum of Understanding (MOU) on Zero-Emission Medium- and Heavy-Duty Vehicles, which targets 30% ZEV sales in M/HDVs by 2030, 100% by 2040.",2022,M/HDV,CALSTART: Drive to Zero MOU
Cyprus,Multi-national,Objective,Signatory to COP26 ZEV Declaration to work towards all sales of new cars and vans being zero emission by no later than 2035 in leading markets.,2022,LDV,Accelerating to Zero Coalition
Denmark,National,Legislation,Road tax for trucks will be based on CO2 emissions from 2025.,2022,"M/HDV, Taxation",Government of Denmark
Denmark,Multi-national,Objective,Signatory to COP26 ZEV Declaration to work towards all sales of new cars and vans being zero emission by no later than 2035 in leading markets.,2022,LDV,Accelerating to Zero Coalition
Dominican Republic,Multi-national,Objective,Signatory to COP26 ZEV Declaration to work towards all sales of new cars and vans being zero emission globally by 2040.,2022,LDV,Accelerating to Zero Coalition
Dominican Republic,Multi-national,Objective,"Signatory of the Memorandum of Understanding (MOU) on Zero-Emission Medium- and Heavy-Duty Vehicles, which targets 30% ZEV sales in M/HDVs by 2030, 100% by 2040.",2022,M/HDV,CALSTART: Drive to Zero MOU
El Salvador,Multi-national,Objective,Signatory to COP26 ZEV Declaration to work towards all sales of new cars and vans being zero emission by no later than 2035 in leading markets.,2022,LDV,Accelerating to Zero Coalition
Ethiopia,National,Legislation,"EVs are not subject to import duties if locally assembled, reduced rates apply for partially and fully assembled imports. They are also exempt from VAT, surtax, and excise tax.",2022,Taxation,Government of Ethiopia
European Union,Supranational,Proposal,"Euro 7 Regulations (provisional agreement) combine LDV and HDV regulations into one act, seeking a 35% and 13% reduction of nitrogen oxides (NOx) and tailpipe emissions, respectively, from LDVs, and 56% and 39% from HDVs relative to Euro 6/VI. Introduces minimum durability standards for LDV batteries of 80% performance by year 5 (or 100 000 km), and 70% performance between years 5 and 8 (or 160 000 km), and also regulates emissions from tyres and brakes for the first time.",2022,"LDV, M/HDV",European Commission
European Union,Supranational,Proposal,"Critical Raw Materials Act aims to reduce dependency on external suppliers of critical raw materials, including those needed to manufacture batteries.",2022,Manufacturing,European Commission
European Union,Supranational,Legislation,"CO2 emission standards: 15% CO2 emission reduction for both new cars and vans by 2025 compared to 2021 levels, 55% for cars and 50% for vans reduction by 2030, 100% reduction by 2035.",2022,LDV,European Commission
Finland,National,Legislation,"Zero emission cars pay 0% import tax, and the lowest annual basic vehicle tax with additional vehicle tax based on vehicle weight and a fuel multiplier.",2022,"LDV, Taxation",Government of Finland
Finland,National,Legislation,Funding support for alternative fuel infrastructure including charging stations.,2022,EVSE,Government of Finland
Finland,Multi-national,Objective,Signatory to COP26 ZEV Declaration to work towards all sales of new cars and vans being zero emission by no later than 2035 in leading markets.,2022,LDV,Accelerating to Zero Coalition
Cuba,National,Objective,"45% of the total vehicle fleet in the country's state sector to be electric, and 38 000 charging points to be installed by 2030.",2021,"Multiple, EVSE",Government of Cuba
Denmark,Multi-national,Objective,"Signatory of the Memorandum of Understanding (MOU) on Zero-Emission Medium- and Heavy-Duty Vehicles, which targets 30% ZEV sales in M/HDVs by 2030, 100% by 2040.",2021,M/HDV,CALSTART: Drive to Zero MOU
Ecuador,National,Legislation,"Low and zero emission vehicles are exempt from VAT. They are also exempt of import taxes, along with charging equipment.",2021,Taxation,Government of Ecuador
El Salvador,National,Announced target,Scenarios include 7-20% EV sales penetration in 2030.,2021,Multiple,Government of El Salvador
Finland,National,Objective,700 000 electric car and 45 000 electric van stock by 2030 (of which at least 50% are BEVs).,2021,LDV,Government of Finland
Czechia,National,Legislation,"Exemption from registration fee and road tolls for BEV, FCEV, and HEVs with CO2 emissions less than 50 grammes per km.",2020,"LDV, Taxation",Government of the Czech Republic
Czechia,National,Objective,50% share of alternatively fuelled vehicles in the government (public) fleet (M1 and N1) by 2030.,2020,LDV,Government of the Czech Republic
Denmark,National,Objective,1 million passenger LDV stock to be ZEV by 2030.,2020,LDV,Government of Denmark
Dominican Republic,National,Objective,"30% of the fleet to be electric by 2030, and 100% by 2050.",2020,Bus,Government of the Dominican Republic
Dominican Republic,National,Objective,"14 000 charging stations in 2030, 150 000 by 2050.",2020,EVSE,Government of the Dominican Republic
Dominican Republic,National,Objective,10% of the private car fleet being EVs by 2030; 70% by 2050 (10% and 50% for the light commercial fleet).,2020,LDV,Government of the Dominican Republic
Dominican Republic,National,Objective,EV owners pay only 50% of the new car sales VAT tax and the first license plate.,2020,Taxation,Government of the Dominican Republic
Dominican Republic,National,Objective,5% of the private motorcycle fleet (plus 20% of the public sector fleet) to be electric by 2030; 35% by 2050.,2020,2/3W,Government of the Dominican Republic
European Union,Supranational,Objective,30 million passenger ZEV stock by 2030 and nearly all passenger LDV and HDV stock by 2050 (Sustainable and Smart Mobility Strategy).,2020,"LDV, M/HDV",European Commission
Finland,National,Announced target,"At least 250 000 BEV, FCEV, and PHEVs by 2030.",2020,Multiple,Government of Finland
Colombia,National,Legislation,Minimum EV purchase quota of 30% for public service fleets by 2025.,2019,Bus,Government of Colombia
Colombia,National,Legislation,Minimum EV charging infrastructure requirements specify a minimum of 5 charging stations in all Special Category municipalities and 20 stations by 2022 in Bogotá.,2019,EVSE,Government of Colombia
Colombia,National,Legislation,"A national minimum share of 30% EVs for new public buses purchased or rented by 2025, while city bus fleets must ensure that 10% of new buses are EVs in 2025, rising every two years up to 100% by 2035.",2019,Bus,Government of Colombia
Colombia,National,Legislation,Law 1972 of 2019: 100% Compliance with Euro-VI equivalent standards for all HDVs in circulation by 2035.,2019,M/HDV,Government of Colombia
Colombia,National,Objective,600 000 EV stock (i.e. registrations) across all modes by 2030.,2019,Multiple,Government of Colombia
Ecuador,National,Legislation,100% of new public transport fleet to be electric by 2025.,2019,Bus,Government of Ecuador
European Union,Supranational,Announced target,"Clean Vehicles Directive: Public procurement targets of 6% to 10% share of clean HDV (N2 and N3) sales by 2026, and 7% to 15% by 2031.",2019,M/HDV,European Commission
European Union,Supranational,Announced target,"Clean Vehicles Directive: Public procurement targets of 27% to 45% share of clean bus (M3) sales by 2026, and 33% to 65% by 2031, 50% of which must be ZEVs (or 25% if 80% or more of bus purchases in that period are double-deckers).",2019,Bus,European Commission
European Union,Supranational,Announced target,Clean Vehicles Directive: EV public procurement targets of 17.6% to 38.5% EV share of LDV sales by 2025.,2019,LDV,European Commission
European Union,Supranational,Objective,European Green Deal: 13 million low-emission passenger vehicles by 2025.,2019,LDV,European Commission
Costa Rica,National,Objective,"By 2050, 60% of the fleet of light vehicles (private and institutional) will be zero emissions.",2018,LDV,Government of Costa Rica
Costa Rica,National,Objective,At least 50% of cargo to be highly efficient by 2050.,2018,M/HDV,Government of Costa Rica
Costa Rica,National,Objective,"70% of taxis to be zero-emissions by 2035, 100% by 2050.",2018,LDV,Government of Costa Rica
Costa Rica,National,Objective,"70% of buses to be zero-emissions by 2035, 100% by 2050.",2018,Bus,Government of Costa Rica
Costa Rica,National,Objective,"25% of the fleet should be electric by 2035, 60% by 2050, and 100% of new sales by 2050.",2018,LDV,Government of Costa Rica
Denmark,National,Announced target,"Urban public transport to be emission-free from 2030, starting with new sales from 2020. 75% of public buses will be low- or zero-emission by 2030.",2018,Bus,Government of Denmark
China,National,Objective,"Aiming to increase competitiveness in the global auto industry by 2025, focussing on NEVs and intelligent vehicle technologies. (China's mid-to-long-term automotive industry development plan).",2017,Manufacturing,"China, Ministry of Industry and Information Technology"
Costa Rica,National,Legislation,Tax exemptions and reductions when purchasing an EV.,2017,Taxation,Government of Costa Rica
Czechia,National,Legislation,Funding available for government or municipal purchases of alternatively fuelled vehicles with 80% of funding for BEV/PHEV solutions.,2017,Multiple,Government of the Czech Republic
Finland,National,Proposal,"Reform of benefit-in-kind taxation to favour low-emissions vehicles, and vehicle charging benefits will no longer be taxable.",,"LDV, Taxation",Government of Finland
France,National,Legislation,"Tax on the mass of passenger vehicles will include BEVs from the 1st July 2026, with extra penalties added to any electric car with a weight exceeding 2.1 tonnes (including a deduction of 600 kg compared to other cars). FCEVs are exempted from this tax.",2025,"LDV, Taxation",Government of France
Greece,National,Proposal,50% of new registrations of passenger cars and 40% of new registrations of LCVs must be electric by 2030 (National Energy Climate Plan).,2024,LDV,Government of Greece
France,National,Announced target,"Reach 400 000 public charging points by 2030, including at least 50 000 with fast charging for a total of 8 GW of public charging capacity.",2023,EVSE,Government of France
France,National,Legislation,"Grants towards the purchase of a new BEV/FCEV, as well as used EVs and retrofits, bonuses for low-income individuals. The grants were lowered from a maximum of 7000 EUR to 4000 EUR.",2023,LDV,Government of France
France,National,Legislation,"EVs must meet a minimum environmental score based on production, assembly, battery, and transport and logistics in order to qualify for French subsidies and some fiscal measures",2023,"Multiple, Manufacturing",Government of France
Ghana,Multi-national,Objective,"Signatory of the Memorandum of Understanding (MOU) on Zero-Emission Medium- and Heavy-Duty Vehicles, which targets 30% ZEV sales in M/HDVs by 2030, 100% by 2040.",2023,M/HDV,CALSTART: Drive to Zero MOU
Honduras,National,Proposal,"20% of the fleet being electric by 2050, and 100% zero or low emission vehicles for light vehicles sales by 2050.",2023,LDV,Government of Honduras
France,National,Legislation,Grant of up to 40% of the cost of a new EV/FCEV truck.,2022,M/HDV,Government of France
France,Multi-national,Objective,Signatory to COP26 ZEV Declaration to work towards all sales of new cars and vans being zero emission by no later than 2035 in leading markets.,2022,LDV,Accelerating to Zero Coalition
Gambia,National,Announced target,"Promote low emission fuel and HEVs, introduce an age limit of a maximum of 3 years for imported vehicles.",2022,LDV,Government of Gambia
Germany,National,Announced target,Approximately one-third of kilometres travelled to take place on the basis of electrical drives or eFuels by 2030.,2022,M/HDV,Government of Germany
Germany,Multi-national,Objective,"The pledge goal is 100% zero-emission LDV acquisitions of civil government owned and operated fleet, with aspirations for 100% zero-emission M/HDV acquisitions, by no later than 2035. Germany also specifically for 100% of all new or replacement vehicles to be environmentally friendly drive technologies by 2030, and by 2025 at least 50% of which will be electric drives.",2022,"LDV, M/HDV",Zero Emissions Government Fleet Declaration
Ghana,National,Objective,"4%, 16%, and 32% of cars sold to be EVs in 2025, 2030, and 2050 respectively.",2022,LDV,Government of Ghana
Ghana,National,Objective,"4%, 16%, and 32% of public buses sold to be EVs in 2025, 2030, and 2050 respectively.",2022,Bus,Government of Ghana
Ghana,Multi-national,Objective,Signatory to COP26 ZEV Declaration to work towards all sales of new cars and vans being zero emission globally by 2040.,2022,LDV,Accelerating to Zero Coalition
Greece,National,Legislation,"From 2024, 25% of new company cars to have emissions less than 50gCO2/km from 2024. 33% of taxis and leased vehicles to be zero-emissions from 2026.",2022,LDV,Government of Greece
Greece,National,Legislation,Ensure adequate charging facilities to meet EV targets.,2022,EVSE,Government of Greece
Greece,Multi-national,Objective,Signatory to COP26 ZEV Declaration to work towards all sales of new cars and vans being zero emission by no later than 2035 in leading markets.,2022,LDV,Accelerating to Zero Coalition
Holy See,Multi-national,Objective,Signatory to COP26 ZEV Declaration to work towards all sales of new cars and vans being zero emission by no later than 2035 in leading markets.,2022,LDV,Accelerating to Zero Coalition
Honduras,National,Proposal,At least 50% EVs in the urban public transport sector for passengers and light cargo by 2030. Announcement of possible adoption of ZEVs for mass public transport.,2022,Bus,Government of Honduras
Finland,National,Objective,4 600 electric trucks by 2030.,2021,M/HDV,Government of Finland
Finland,Multi-national,Objective,"Signatory of the Memorandum of Understanding (MOU) on Zero-Emission Medium- and Heavy-Duty Vehicles, which targets 30% ZEV sales in M/HDVs by 2030, 100% by 2040.",2021,M/HDV,CALSTART: Drive to Zero MOU
France,National,Legislation,"Implementation of LEZs in metropolitan agglomerations of more than 150 000 inhabitants by 31 December 2024, and provision for interest-free EV purchase loans to low-income households living in these zones.",2021,Multiple,Government of France
France,National,Legislation,Express deduction of 20-60% of the investment cost in alternatively fuelled trucks depending on vehicle size.,2021,"M/HDV, Taxation",Government of France
France,National,Legislation,No new sales of new HDVs assigned to the transport of people or goods and using mainly fossil fuels by 2040.,2021,M/HDV,Government of France
France,National,Legislation,End sale of new passenger cars emitting more than 123 g CO2/km by 2030.,2021,LDV,Government of France
France,National,Objective,Produce 2 million electric and hybrid cars domestically by 2030.,2021,"Manufacturing, LDV",Government of France
Greece,National,Legislation,"Registration tax exemption for BEVs; reduction of 75% for PHEVs; and reduction of 50% for HEVs. BEVs, PHEVs, and HEVs (>1549 cc) are exempt from annual circulation tax. BEVs and PHEVs as company vehicles are exempt from benefit-in-kind tax.",2021,LDV,Governmental
France,National,Legislation,Tax relief available on the installation of a home charger.,2020,"EVSE, Taxation",Government of France
France,National,Legislation,Subsidies of 30% of the cost of the installation of chargers that are made publicly available.,2020,EVSE,Government of France
Georgia,National,Legislation,"Incentives to promote EV adoption, such as VAT exemptions and reduced import taxes for electric and hybrid vehicles.",2020,"Taxation, Multiple",Government of Georgia
Greece,National,Legislation,Grants towards the purchase of new private BEVs and taxis. These grants are also dependent on returning old cars for scrappage and the age of the BEV buyer.,2020,LDV,Governmental
Hungary,National,Legislation,"Grants towards the private and commercial purchase of a BEV, up to 55% of the purchase cost for taxis.",2020,LDV,Government of Hungary
France,National,Legislation,"In 2022, companies with over 100 LDVs must include at least 10% low-emissions vehicles in their renewals, rising to 20% in 2024, 35% in 2027, and 50% by 2030 (Article 77).",2019,LDV,Government of France
France,National,Legislation,End sale of new fossil fuel LDVs by 2040.,2019,LDV,Government of France
France,National,Legislation,"At least 50% of public/state LDV renewals must be low-emission vehicles, rising to 70% from 2027. For local authorities, from 2026, 37.4% of all LDV renewals must be very low-emissions.",2019,LDV,Government of France
France,National,Legislation,"At least 50% of public buses and coaches must be low-emissions, 100% from 2025. In large towns/cities, at least 50% of buses must be very low-emission from 2022.",2019,Bus,Government of France
France,National,Objective,"200 heavy commercial FCEV stock by 2023, and 800-2 000 heavy commercial FCEV stock by 2028.",2019,M/HDV,Government of France
Germany,National,Objective,Plan to have 15 million EVs on Germany roads by 2030,2019,LDV,Government of Germany
Hungary,National,Legislation,"Funded programme that seeks to replace existing bus fleet with electric (BEV, FCEV, and trolley e-bus) options and encourage local production.",2019,"Bus, Manufacturing",Government of Hungary
France,National,Objective,5 000 passenger and commercial LDV FCEV stock by 2023 and 20 000-50 000 by 2028.,2018,LDV,Government of France
Germany,National,Legislation,"Motor tax exemption for EVs with less than 50g CO2/km emissions or at least 60km range (80km from 2025) until 2030. Privileges for electric cars on German roads, e.g. car parking and bus lane use.",2012,"LDV, Taxation",Government of Germany
Germany,National,Legislation,"10 year (up to 2030) exemption of vehicle taxes for commercial EVs, as well as other tax incentives for company cars, and company-facilitated EV charging for new registrations until 31/12/2025.",,Taxation,Government of Germany
Iceland,National,Legislation,"As of 2024, electric and hybrid vehicles will pay road tax per kilometre driven, this will be ISK 6 (Icelandic kronur) (USD 0.04) per km. For diesel and petrol cars this will come into effect one year later, in 2025.",2024,"LDV, Taxation",Government of Iceland
India,National,Announced target,"India’s Bureau of Energy Efficiency has shared a draft of future corporate average fuel economy (CAFE) III and IV standards for light-duty passenger vehicles with relevant stakeholders to seek their comments. The proposed standards cover model years 2027–2032 and 2032–2037, respectively, and target CO2 emissions of 91.7 g CO2/km and 70 g CO2/km as measured over the WLTC.",2024,LDV,"Bureau of Energy Efficiency, India"
India,National,Legislation,"PM e-Bus Sewa-Payment Security Mechanism (PSM) Scheme: Rs. 3,435.33 crore (USD 412 million) to support the deployment of more than 38,000 electric buses in the country.",2024,Bus,"India, Department of Heavy Industries"
India,National,Legislation,"Scheme to Promote Manufacturing of Electric Passenger Cars in India (SMEC). Carmakers committing to setup e-4W manufacturing facilities in India within 3 years, and to achieve 50% domestic value addition within 5 years, will be allowed to import a limited amount of electric cars manufactured by them with reduced import duties.",2024,Manufacturing,"India, Department of Heavy Industries"
India,National,Legislation,"PM Electric Drive Revolution in Innovative Vehicle Enhancement (PM E-DRIVE) Scheme. USD 1.3 billion scheme to provide purchase incentives for e-2W, e-3W, e-ambulances, e-trucks and other new emerging EV categories.",2024,Multiple,"India, Department of Heavy Industries"
Israel,National,Proposal,"EV purchase tax rates (currently 10% but to increase to 20%) are lower than ICE purchases taxes (83%); for plug-in hybrid vehicles (PHEVs), purchase taxes are set to increase from 40% to 55%.",2024,Taxation,Government of Israel
Japan,National,Announced target,Aims to account for 30% of the 35-41 million global software-defined vehicle (SDV) sales in 2030 - about 11-12 million units. The Japanese government also targets a stock of 17-19 million SDVs by 2035 (and 30% of global SDV sales).,2024,LDV,Government of Japan
Japan,National,Legislation,Purchase subsidies for passenger cars.,2024,LDV,Government of Japan
Japan,National,Legislation,"Purchase subsidies for buses, vans and trucks for commercial use.",2024,M/HDV,Government of Japan
